<?xml version="1.0" encoding="utf-8"?><!DOCTYPE message SYSTEM "message.dtd"[]><message><header><protocol><type>PelleMsg</type><version>1.0</version><command>sendMsg</command></protocol><id><name>erwterw</name><email>pelle@mailpunktse</email><homepage>www.tfk.com</homepage><host>pelle</host></id></header><body>d</body></message>